{
  "id": "phase-20-harness-ablation-v1",
  "bootstrap_samples": 4000,
  "bootstrap_seed": 20260904,
  "per_workload_budget": {
    "cost_units": 200,
    "wall_time_ms": 2500,
    "human_minutes": 30
  },
  "decision_thresholds": {
    "progress_ci_lower": 0,
    "minimum_integrity_violations_avoided": 3,
    "minimum_duplicates_avoided": 3,
    "maximum_cost_ratio": 1.1
  },
  "mechanism_profiles": [
    {"mechanism": "frozen_protocols", "cost_units": 1, "wall_time_ms": 10, "human_minutes": 0.1, "complexity_points": 3},
    {"mechanism": "evaluation_isolation", "cost_units": 3, "wall_time_ms": 30, "human_minutes": 0.2, "complexity_points": 5},
    {"mechanism": "shared_survey_forum", "cost_units": 1, "wall_time_ms": 10, "human_minutes": 0.1, "complexity_points": 4},
    {"mechanism": "fresh_sessions", "cost_units": 2, "wall_time_ms": 20, "human_minutes": 0.1, "complexity_points": 2},
    {"mechanism": "integrity_monitoring", "cost_units": 4, "wall_time_ms": 40, "human_minutes": 0.5, "complexity_points": 7}
  ],
  "workload_groups": [
    {
      "id": "selection-historical-clean",
      "split": "selection",
      "source": "historical_replay",
      "family": "continual-recall-replay",
      "count": 4,
      "defects": [],
      "has_valid_candidate": true,
      "transfer_score": 0.72,
      "base_cost_units": 100,
      "base_wall_time_ms": 1000,
      "base_human_minutes": 1,
      "historical_artifact": "campaigns/first-discovery/result.json",
      "historical_sha256": "f269c210f9a52e08cca1a7e45839f1886946a03a4c75989c9540fa27bb5b75dd",
      "human_idea": {"valid": true, "transfer_score": 0.68, "cost_units": 45, "wall_time_ms": 500, "human_minutes": 12}
    },
    {
      "id": "selection-historical-protocol",
      "split": "selection",
      "source": "historical_replay",
      "family": "method-replay",
      "count": 4,
      "defects": ["protocol_drift"],
      "has_valid_candidate": true,
      "transfer_score": 0.70,
      "base_cost_units": 100,
      "base_wall_time_ms": 1000,
      "base_human_minutes": 1,
      "historical_artifact": "campaigns/first-discovery/result.json",
      "historical_sha256": "f269c210f9a52e08cca1a7e45839f1886946a03a4c75989c9540fa27bb5b75dd",
      "human_idea": {"valid": true, "transfer_score": 0.66, "cost_units": 45, "wall_time_ms": 500, "human_minutes": 12}
    },
    {
      "id": "selection-evaluation-defect",
      "split": "selection",
      "source": "synthetic",
      "family": "evaluation-isolation",
      "count": 4,
      "defects": ["evaluation_leakage", "capability_regression"],
      "has_valid_candidate": false,
      "transfer_score": 0,
      "base_cost_units": 100,
      "base_wall_time_ms": 1000,
      "base_human_minutes": 1
    },
    {
      "id": "selection-duplicate",
      "split": "selection",
      "source": "synthetic",
      "family": "survey-deduplication",
      "count": 4,
      "defects": ["duplicated_work"],
      "has_valid_candidate": false,
      "transfer_score": 0,
      "base_cost_units": 100,
      "base_wall_time_ms": 1000,
      "base_human_minutes": 1
    },
    {
      "id": "selection-context",
      "split": "selection",
      "source": "synthetic",
      "family": "fresh-session-continuity",
      "count": 4,
      "defects": ["context_contamination"],
      "has_valid_candidate": true,
      "transfer_score": 0.69,
      "base_cost_units": 100,
      "base_wall_time_ms": 1000,
      "base_human_minutes": 1,
      "human_idea": {"valid": true, "transfer_score": 0.64, "cost_units": 50, "wall_time_ms": 600, "human_minutes": 15}
    },
    {
      "id": "selection-integrity",
      "split": "selection",
      "source": "synthetic",
      "family": "integrity-adversarial",
      "count": 4,
      "defects": ["integrity_violation"],
      "has_valid_candidate": false,
      "transfer_score": 0,
      "base_cost_units": 100,
      "base_wall_time_ms": 1000,
      "base_human_minutes": 1
    },
    {
      "id": "heldout-clean",
      "split": "held_out",
      "source": "synthetic",
      "family": "causal-transfer",
      "count": 4,
      "defects": [],
      "has_valid_candidate": true,
      "transfer_score": 0.76,
      "base_cost_units": 100,
      "base_wall_time_ms": 1000,
      "base_human_minutes": 1,
      "human_idea": {"valid": true, "transfer_score": 0.70, "cost_units": 50, "wall_time_ms": 600, "human_minutes": 14}
    },
    {
      "id": "heldout-protocol",
      "split": "held_out",
      "source": "synthetic",
      "family": "compositional-transfer",
      "count": 4,
      "defects": ["protocol_drift"],
      "has_valid_candidate": true,
      "transfer_score": 0.74,
      "base_cost_units": 100,
      "base_wall_time_ms": 1000,
      "base_human_minutes": 1,
      "human_idea": {"valid": true, "transfer_score": 0.67, "cost_units": 50, "wall_time_ms": 600, "human_minutes": 14}
    },
    {
      "id": "heldout-evaluation-defect",
      "split": "held_out",
      "source": "synthetic",
      "family": "planning-evaluation",
      "count": 4,
      "defects": ["capability_regression"],
      "has_valid_candidate": false,
      "transfer_score": 0,
      "base_cost_units": 100,
      "base_wall_time_ms": 1000,
      "base_human_minutes": 1
    },
    {
      "id": "heldout-duplicate",
      "split": "held_out",
      "source": "synthetic",
      "family": "program-induction-survey",
      "count": 4,
      "defects": ["duplicated_work"],
      "has_valid_candidate": false,
      "transfer_score": 0,
      "base_cost_units": 100,
      "base_wall_time_ms": 1000,
      "base_human_minutes": 1
    },
    {
      "id": "heldout-context",
      "split": "held_out",
      "source": "synthetic",
      "family": "system-identification-continuity",
      "count": 4,
      "defects": ["context_contamination"],
      "has_valid_candidate": true,
      "transfer_score": 0.71,
      "base_cost_units": 100,
      "base_wall_time_ms": 1000,
      "base_human_minutes": 1,
      "human_idea": {"valid": true, "transfer_score": 0.65, "cost_units": 55, "wall_time_ms": 700, "human_minutes": 16}
    },
    {
      "id": "heldout-integrity",
      "split": "held_out",
      "source": "synthetic",
      "family": "continual-transfer-integrity",
      "count": 4,
      "defects": ["integrity_violation"],
      "has_valid_candidate": false,
      "transfer_score": 0,
      "base_cost_units": 100,
      "base_wall_time_ms": 1000,
      "base_human_minutes": 1
    }
  ]
}
